"DESCRIPTION","DURATION IN MS","NAME","PARENT SUITE","START TIME","STATUS","STOP TIME","SUB SUITE","SUITE","TEST CLASS","TEST METHOD"
"Verifies that a message request cannot be sent when Community Message Requests are off.","80168","Community message requests off @ios @medium-risk @2-devices","","Tue Oct 28 15:04:32 AEDT 2025","failed","Tue Oct 28 15:05:53 AEDT 2025","","community_requests_off.spec.ts","",""
"Verifies the alternate icons on the App Disguise page look as expected","87098","Check app disguise icon layout @ios @medium-risk @1-devices","Settings","Tue Oct 28 15:03:04 AEDT 2025","passed","Tue Oct 28 15:04:31 AEDT 2025","","App Disguise","",""
"Verifies the alternate icon set on the App Disguise page is applied","87984","App disguise set icon @ios @medium-risk @1-devices","Settings","Tue Oct 28 15:03:04 AEDT 2025","passed","Tue Oct 28 15:04:32 AEDT 2025","","App Disguise","",""
"Verifies that an emoji reaction can be sent and is received in a community","70671","Send emoji react community @ios @medium-risk @2-devices","Sending Messages","Tue Oct 28 15:04:32 AEDT 2025","passed","Tue Oct 28 15:05:42 AEDT 2025","","Emoji reacts","",""
"Verifies that a user's placeholder avatar color appears the same to a contact","114395","Check placeholder avatar color @ios @medium-risk @2-devices","Visual Checks","Tue Oct 28 15:03:04 AEDT 2025","passed","Tue Oct 28 15:04:59 AEDT 2025","","Settings","",""
