"DESCRIPTION","DURATION IN MS","NAME","PARENT SUITE","START TIME","STATUS","STOP TIME","SUB SUITE","SUITE","TEST CLASS","TEST METHOD"
"Verifies that the ""Learn More"" link on the Network Page opens the correct URL in the device browser.","21259","Network page learn more network link @ios @medium-risk @1-devices","Network Page","Mon Jan 19 14:34:11 AEDT 2026","passed","Mon Jan 19 14:34:32 AEDT 2026","","network_page_link_network.spec.ts","",""
"Verifies that a seed phrase with a word not on the mnemonic list throws the 'some words are incorrect' error as expected.","173377","Onboarding incorrect seed @ios @low-risk @1-devices","Onboarding","Mon Jan 19 14:14:47 AEDT 2026","passed","Mon Jan 19 14:17:40 AEDT 2026","","Input validations","",""
"Verifies that only admins can enable Disappearing Messages in a group","306168","Group member disappearing messages @ios @medium-risk @3-devices","Disappearing Messages","Mon Jan 19 13:46:46 AEDT 2026","passed","Mon Jan 19 13:51:52 AEDT 2026","","Rules","",""
"Verifies the in-app review modal texts and buttons for the negative flow (Enjoying Session - Give Feedback - Open URL)","26211","Review prompt negative flow @ios @high-risk @1-devices","In-App Review Prompt","Mon Jan 19 14:35:30 AEDT 2026","passed","Mon Jan 19 14:35:56 AEDT 2026","","Flows","",""
"Verifies that message bubbles appear as expected (oneline and multiline messages, reply layout, outgoing/incoming)","40970","Check message bubble layout @ios @high-risk @2-devices","Visual Checks","Mon Jan 19 14:40:35 AEDT 2026","passed","Mon Jan 19 14:41:16 AEDT 2026","","Conversation","",""
"Verifies that a user can set a nickname for a contact and that it appears correctly in the conversation settings, conversation header and home screen.","30700","Set nickname @ios @high-risk @2-devices","User Actions","Mon Jan 19 14:39:08 AEDT 2026","passed","Mon Jan 19 14:39:38 AEDT 2026","","Set Nickname","",""
"","68819","Create contact @ios @high-risk @3-devices","","Mon Jan 19 14:37:18 AEDT 2026","passed","Mon Jan 19 14:38:27 AEDT 2026","","user_actions_create_contact.spec.ts","",""
"","41541","Accept message request with text @ios @high-risk @2-devices","","Mon Jan 19 14:31:40 AEDT 2026","passed","Mon Jan 19 14:32:22 AEDT 2026","","message_requests_accept_text_reply.spec.ts","",""
"Verifies that the Privacy settings screen layout matches the expected baseline","19252","Check Privacy settings layout @ios @high-risk @1-devices","Visual Checks","Mon Jan 19 14:40:39 AEDT 2026","passed","Mon Jan 19 14:40:58 AEDT 2026","","Settings","",""
"Verifies that a user's avatar color is consistent across linked devices.","90913","Avatar color linked device @ios @medium-risk @2-devices","Visual Checks","Mon Jan 19 14:18:25 AEDT 2026","passed","Mon Jan 19 14:19:56 AEDT 2026","","Onboarding","",""
"Verifies that the ""Learn More"" link on the Network Page for Staking opens the correct URL in the device browser.","23038","Network page learn more staking link @ios @medium-risk @1-devices","Network Page","Mon Jan 19 14:34:33 AEDT 2026","passed","Mon Jan 19 14:34:56 AEDT 2026","","network_page_link_staking.spec.ts","",""
"Verifies that an image can be sent to a group, all members receive the document, and replying to a document works as expected","64048","Send image to group @ios @high-risk @3-devices","Sending Messages","Mon Jan 19 13:55:26 AEDT 2026","passed","Mon Jan 19 13:56:30 AEDT 2026","","Message types","",""
"Verifies that a group description can be at most 200 chars and that every member can see a valid change.","122895","Change group description @ios @medium-risk @3-devices","Groups","Mon Jan 19 13:59:13 AEDT 2026","passed","Mon Jan 19 14:01:16 AEDT 2026","","Edit Group","",""
"Verifies that a community invite disappears as expected in a 1:1 conversation","146507","Disappearing community invite message 1:1 @ios @low-risk @2-devices","Disappearing Messages","Mon Jan 19 13:33:52 AEDT 2026","passed","Mon Jan 19 13:36:18 AEDT 2026","","Message Types","",""
"Verifies that local deletion in a group does not delete a message for other participants.","46751","Delete message locally in group @ios @high-risk @3-devices","User Actions","Mon Jan 19 13:53:25 AEDT 2026","passed","Mon Jan 19 13:54:12 AEDT 2026","","Delete Message","",""
"Verifies that a blocked user syncs to a linked device","52066","Block user linked device @ios @high-risk @3-devices","User Actions","Mon Jan 19 14:20:35 AEDT 2026","passed","Mon Jan 19 14:21:27 AEDT 2026","","Block/Unblock","",""
"Sends a message 10 times in a 1-1 and logs the sending time","41689","Check performance @ios @low-risk @2-devices","Sending Messages","Mon Jan 19 14:25:15 AEDT 2026","passed","Mon Jan 19 14:25:57 AEDT 2026","","Performance","",""
"","34742","Message requests clear all @ios @medium-risk @2-devices","","Mon Jan 19 14:32:34 AEDT 2026","passed","Mon Jan 19 14:33:09 AEDT 2026","","message_requests_clear_all.spec.ts","",""
"","19154","Onboarding terms of service @ios @high-risk @1-devices","","Mon Jan 19 14:35:08 AEDT 2026","passed","Mon Jan 19 14:35:27 AEDT 2026","","onboarding_tos.spec.ts","",""
"Verifies that ONS resolution works","28313","ONS resolution @ios @high-risk @1-devices","New Conversation","Mon Jan 19 14:35:27 AEDT 2026","passed","Mon Jan 19 14:35:55 AEDT 2026","","New Message","",""
"Verifies that a too long seed phrase throws the 'check your recovery password' error as expected.","53283","Onboarding wrong seed @ios @low-risk @1-devices","Onboarding","Mon Jan 19 14:17:27 AEDT 2026","passed","Mon Jan 19 14:18:20 AEDT 2026","","Input validations","",""
"","41986","Read status @ios @medium-risk @2-devices","","Mon Jan 19 14:39:07 AEDT 2026","passed","Mon Jan 19 14:39:49 AEDT 2026","","user_actions_read_status.spec.ts","",""
"Verifies that a too long display name (101 bytes) throws the 'shorter display name' error as expected.","218134","Onboarding long name @ios @low-risk @1-devices","Onboarding","Mon Jan 19 14:08:21 AEDT 2026","passed","Mon Jan 19 14:11:59 AEDT 2026","","Input validations","",""
"Verifies the alternate icon set on the App Disguise page is applied","68850","App disguise set icon @ios @medium-risk @1-devices","Settings","Mon Jan 19 13:25:07 AEDT 2026","passed","Mon Jan 19 13:26:16 AEDT 2026","","App Disguise","",""
