"DESCRIPTION","DURATION IN MS","NAME","PARENT SUITE","START TIME","STATUS","STOP TIME","SUB SUITE","SUITE","TEST CLASS","TEST METHOD"
"Verifies that the landing page for a new account matches the expected baseline","15527","Check landing page (new account) layout @ios @low-risk @1-devices","Visual Checks","2026-03-18","passed","2026-03-18","","Onboarding","",""
"Verifies that a group created on one device appears on a linked device, and that a group name change syncs to all members.","121785","Create group and change name syncs @ios @high-risk @4-devices","Groups","2026-03-18","passed","2026-03-18","","Create Group","",""
"Verifies that leaving a group syncs to a linked device","103900","Leave group linked device @ios @high-risk @4-devices","Groups","2026-03-18","passed","2026-03-18","","Leave/Delete Group","",""
"Verifies that the latest release banner is present on the Invite Contacts screen","36867","Invite contacts banner @ios @medium-risk @3-devices","Groups","2026-03-18","passed","2026-03-18","","Edit Group","",""
"Verifies that an empty display name throws the 'please enter a display name' error as expected.","10368","Onboarding no name @ios @low-risk @1-devices","Onboarding","2026-03-18","passed","2026-03-18","","Input validations","",""
"Verifies that 'Disappear After Read' can be set in a 1:1 conversation, and that a message disappears after the specified expiry time.","114706","Disappear after read @ios @high-risk @2-devices","Disappearing Messages","2026-03-18","passed","2026-03-18","","Conversation Types","",""
"Verifies the in-app review modal texts and buttons for the negative flow (Enjoying Session - Give Feedback - Open URL)","23470","Review prompt negative flow @ios @high-risk @1-devices","In-App Review Prompt","2026-03-18","passed","2026-03-18","","Flows","",""
"","38155","Accept message request with text @ios @high-risk @2-devices","","2026-03-18","passed","2026-03-18","","message_requests_accept_text_reply.spec.ts","",""
"","35219","Unsend message @ios @high-risk @2-devices","","2026-03-18","passed","2026-03-18","","message_unsend.spec.ts","",""
"Verifies that the Network Page refreshes and updates the ""Last updated"" timestamp correctly.","82153","Network page refresh @ios @low-risk @1-devices","Network Page","2026-03-18","passed","2026-03-18","","network_page_refresh_page.spec.ts","",""
"Verifies that an image disappears as expected in a 1:1 conversation","76616","Disappearing image message 1:1 @ios @low-risk @2-devices","Disappearing Messages","2026-03-18","passed","2026-03-18","","Message Types","",""
"Verifies that a message request can be sent when Community Message Requests are on.","44873","Community message requests on @ios @medium-risk @2-devices","Settings","2026-03-18","passed","2026-03-18","","Community Message Requests","",""
"","57431","Delete contact from conversation settings @ios @high-risk @3-devices","User Actions","2026-03-18","passed","2026-03-18","","Delete Contact","",""
"Verifies that the Session Network Page displays the values fetched from the network API correctly.","15397","Network page values @ios @medium-risk @1-devices","Network Page","2026-03-18","passed","2026-03-18","","network_page_values.spec.ts","",""
"Verifies that Disappearing Messages can be set in Note to Self, and that a message disappears after the specified expiry time.","82181","Disappear after send note to self @ios @medium-risk @1-devices","Disappearing Messages","2026-03-18","passed","2026-03-18","","Conversation Types","",""
"Verifies that a user can be blocked from the conversation settings","47401","Block user in conversation settings @ios @high-risk @2-devices","User Actions","2026-03-18","passed","2026-03-18","","Block/Unblock","",""
"Verifies that Disappearing Messages can be set in a group conversation, and that a message disappears after the specified expiry time.","67298","Disappear after send groups @ios @high-risk @3-devices","Disappearing Messages","2026-03-18","failed","2026-03-18","","Conversation Types","",""
"Verifies that a too long display name (101 bytes) throws the 'shorter display name' error as expected.","12038","Onboarding long name @ios @low-risk @1-devices","Onboarding","2026-03-18","passed","2026-03-18","","Input validations","",""
"Verifies that a group name change syncs to every member.","56638","Change group name @ios @medium-risk @3-devices","Groups","2026-03-18","passed","2026-03-18","","Edit Group","",""
"Verifies that joining a community works and the conversation syncs to a linked device","42948","Join community test @ios @high-risk @2-devices","New Conversation","2026-03-18","passed","2026-03-18","","Join Community","",""
"","50476","Send image 1:1 @ios @high-risk @2-devices","","2026-03-18","passed","2026-03-18","","message_image.spec.ts","",""
