"DESCRIPTION","DURATION IN MS","NAME","PARENT SUITE","START TIME","STATUS","STOP TIME","SUB SUITE","SUITE","TEST CLASS","TEST METHOD"
"","51441","Read status @android @medium-risk @2-devices","","2026-02-20","passed","2026-02-20","","user_actions_read_status.spec.ts","",""
"Verifies that a message request can be sent when Community Message Requests are on.","68985","Community message requests on @android @medium-risk @2-devices","Settings","2026-02-20","passed","2026-02-20","","Community Message Requests","",""
"Verifies that Disappearing Messages can be set in a group conversation, and that a message disappears after the specified expiry time.","64208","Disappear after send groups @android @high-risk @3-devices","Disappearing Messages","2026-02-20","passed","2026-02-20","","Conversation Types","",""
"Verifies that a user can share an image from one Session conversation to another (forwarding)","41802","Share within Session @android @medium-risk @2-devices","User Actions","2026-02-20","passed","2026-02-20","","Share to Session","",""
"Verifies that a user can share an image from the photo gallery to Session","42487","Share to Session @android @medium-risk @2-devices","User Actions","2026-02-20","passed","2026-02-20","","Share to Session","",""
"Verifies message length behavior at 1799 characters - no countdown shows, message sends","27982","Message length limit (1799 chars) @android @high-risk @1-devices","Sending Messages","2026-02-20","passed","2026-02-20","","Rules","",""
"","47632","Send voice message 1:1 @android @high-risk @2-devices","","2026-02-20","passed","2026-02-20","","message_voice.spec.ts","",""
"Verifies that message bubbles appear as expected (oneline and multiline messages, reply layout, outgoing/incoming)","38860","Check message bubble layout @android @high-risk @2-devices","Visual Checks","2026-02-20","passed","2026-02-20","","Conversation","",""
"","35016","Send link 1:1 @android @high-risk @2-devices","","2026-02-20","passed","2026-02-20","","message_link_preview.spec.ts","",""
"Verifies that inviting a contact to a group with message history works as expected.","84320","Invite contact to group with chat history @android @high-risk @4-devices","Groups","2026-02-20","passed","2026-02-20","","Edit Group","",""
"Verifies that the landing page for a new account matches the expected baseline","17480","Check landing page (new account) layout @android @low-risk @1-devices","Visual Checks","2026-02-20","passed","2026-02-20","","Onboarding","",""
"Verifies that a group created on one device appears on a linked device, and that a group name change syncs to all members.","126646","Create group and change name syncs @android @high-risk @4-devices","Groups","2026-02-20","passed","2026-02-20","","Create Group","",""
"Verifies that a group of 3 can be created successfully via the UI","91918","Create group @android @high-risk @3-devices","Groups","2026-02-20","passed","2026-02-20","","Create Group","",""
"Sends a message 10 times in a 1-1 and logs the sending time","44592","Check performance @android @low-risk @2-devices","Sending Messages","2026-02-20","passed","2026-02-20","","Performance","",""
"Verifies that 'Delete for everyone' in a 1-1 deletes the message in the conversation view and on the home screen for both parties and a linked device.","42962","Unsent message syncs @android @medium-risk @3-devices","User Actions","2026-02-20","passed","2026-02-20","","Delete Message","",""
"","30956","Unsend message @android @high-risk @2-devices","","2026-02-20","passed","2026-02-20","","message_unsend.spec.ts","",""
"Verifies that the in-app review prompt shows after the user visits the Path screen in Settings","17205","Review prompt Path trigger @android @high-risk @1-devices","In-App Review Prompt","2026-02-20","passed","2026-02-20","","Triggers","",""
"Verifies that the in-app review prompt shows after the user presses the Donate button in Settings","19036","Review prompt Donate trigger @android @high-risk @1-devices","In-App Review Prompt","2026-02-20","passed","2026-02-20","","Triggers","",""
"","62458","Send video 1:1 @android @medium-risk @2-devices","","2026-02-20","passed","2026-02-20","","message_video.spec.ts","",""
"Verifies that the profile picture change on one device is reflected on a linked device.","33737","Change profile picture linked device @android @medium-risk @2-devices","User Actions","2026-02-20","passed","2026-02-20","","Change Profile Picture","",""
"Verifies that an emoji reaction can be sent and is received in a 1-1 conversation.","32295","Send emoji react 1:1 @android @high-risk @2-devices","Sending Messages","2026-02-20","passed","2026-02-20","","Emoji reacts","",""
"Verifies that an empty seed phrase throws the 'not long enough' error as expected.","9519","Onboarding no seed @android @low-risk @1-devices","Onboarding","2026-02-20","passed","2026-02-20","","Input validations","",""
"Verifies that the 'Invite a Friend' share functionality opens the native share sheet and the user's Account ID is present in the message.","24792","Invite a friend @android @medium-risk @1-devices","New Conversation","2026-02-20","passed","2026-02-20","","Invite a Friend","",""
"Verifies that a voice message disappears as expected in a 1:1 conversation","71489","Disappearing voice message 1:1 @android @low-risk @2-devices","Disappearing Messages","2026-02-20","passed","2026-02-20","","Message Types","",""
"","43711","Delete message request in list @android @high-risk @2-devices","","2026-02-20","passed","2026-02-20","","message_requests_delete.spec.ts","",""
"Verifies that joining a community works and the conversation syncs to a linked device","42548","Join community test @android @high-risk @2-devices","New Conversation","2026-02-20","passed","2026-02-20","","Join Community","",""
"Verifies that the Privacy settings screen layout matches the expected baseline","18553","Check Privacy settings layout @android @high-risk @1-devices","Visual Checks","2026-02-20","passed","2026-02-20","","Settings","",""
"","68272","Delete message request in conversation @android @high-risk @3-devices","","2026-02-20","passed","2026-02-20","","message_requests_decline.spec.ts","",""
"Verifies the alternate icons on the App Disguise page look as expected","31592","Check app disguise icon layout @android @medium-risk @1-devices","Settings","2026-02-20","passed","2026-02-20","","App Disguise","",""
