"DESCRIPTION","DURATION IN MS","NAME","PARENT SUITE","START TIME","STATUS","STOP TIME","SUB SUITE","SUITE","TEST CLASS","TEST METHOD"
"Verifies that a Pro user can pin 5+ conversations","78707","Pinned conversation limit (Pro) @ios @high-risk @1-devices","Session Pro","2026-02-27","failed","2026-02-27","","user_actions_pin_unpin.spec.ts","",""
"Verifies that a standard user can only pin 5 conversations","56847","Pinned conversation limit (non Pro) @ios @high-risk @1-devices","Session Pro","2026-02-27","failed","2026-02-27","","user_actions_pin_unpin.spec.ts","",""
"","43484","Send GIF 1:1 @ios @medium-risk @2-devices","","2026-02-27","passed","2026-02-27","","message_gif.spec.ts","",""
"","32457","Delete message locally @ios @high-risk @2-devices","","2026-02-27","passed","2026-02-27","","message_deletion.spec.ts","",""
"Verifies that a voice note disappears as expected in a group conversation","74377","Disappearing voice message to group @ios @low-risk @3-devices","Disappearing Messages","2026-02-27","passed","2026-02-27","","Message Types","",""
"Verifies the alternate icons on the App Disguise page look as expected","106493","Check app disguise icon layout @ios @medium-risk @1-devices","Settings","2026-02-27","passed","2026-02-27","","App Disguise","",""
"Verifies that the Notifications settings screen layout matches the expected baseline","16170","Check Notifications settings layout @ios @high-risk @1-devices","Visual Checks","2026-02-27","passed","2026-02-27","","Settings","",""
"Verifies message length behavior at 10000 characters - countdown shows 0, message sends (Pro)","43143","Message length limit (10000 chars Pro) @ios @high-risk @1-devices","Sending Messages","2026-02-27","passed","2026-02-27","","Rules","",""
"Verifies that pinning moves a conversation to the top of the list and unpinning restores the original order","34536","Pin and unpin conversation @ios @medium-risk @1-devices","User Actions","2026-02-27","failed","2026-02-27","","Pin/Unpin","",""
"Verifies that a PDF can be sent to a group, all members receive the document, and replying to a document works as expected","67215","Send document to group @ios @high-risk @3-devices","Sending Messages","2026-02-27","passed","2026-02-27","","Message types","",""
"Mocks a custom install date 7 days 2 minutes ago, opens the app, and verifies that the Donate CTA is shown.","33309","Donate CTA shows if app installed >=7 days ago @ios @high-risk @1-devices","Donations","2026-02-27","passed","2026-02-27","","cta_donate_time.spec.ts","",""
"Verifies that a group member can be kicked from a group and that the kicked member is removed from the group.","46933","Kick member @ios @medium-risk @3-devices","Groups","2026-02-27","passed","2026-02-27","","Edit Group","",""
"Verifies that the latest release banner is present on the Invite Contacts screen","40115","Invite contacts banner @ios @medium-risk @3-devices","Groups","2026-02-27","passed","2026-02-27","","Edit Group","",""
"Verifies the in-app review modal texts and buttons for the positive flow (Enjoying Session - Rate App)","20169","Review prompt positive flow @ios @high-risk @1-devices","In-App Review Prompt","2026-02-27","passed","2026-02-27","","Flows","",""
"Verifies that the Session Network Page displays the values fetched from the network API correctly.","28192","Network page values @ios @medium-risk @1-devices","Network Page","2026-02-27","passed","2026-02-27","","network_page_values.spec.ts","",""
"","37572","Create user @ios @high-risk @1-devices","","2026-02-27","passed","2026-02-27","","user_actions_create_user.spec.ts","",""
"Verifies that an image can be sent to a group, all members receive the document, and replying to a document works as expected","48945","Send image to group @ios @high-risk @3-devices","Sending Messages","2026-02-27","passed","2026-02-27","","Message types","",""
"","70729","Accept message request @ios @high-risk @3-devices","","2026-02-27","failed","2026-02-27","","message_requests_accept.spec.ts","",""
"","74856","Block message request in conversation @ios @high-risk @3-devices","","2026-02-27","passed","2026-02-27","","message_requests_block.spec.ts","",""
"Verifies that a message request cannot be sent when Community Message Requests are off.","46289","Community message requests off @ios @medium-risk @2-devices","Settings","2026-02-27","passed","2026-02-27","","Community Message Requests","",""
"","41905","Send voice message 1:1 @ios @high-risk @2-devices","","2026-02-27","passed","2026-02-27","","message_voice.spec.ts","",""
"","39860","Onboarding terms of service @ios @high-risk @1-devices","","2026-02-27","failed","2026-02-27","","onboarding_tos.spec.ts","",""
"Verifies that an image disappears as expected in a group conversation","121425","Disappearing image message to group @ios @low-risk @3-devices","Disappearing Messages","2026-02-27","failed","2026-02-27","","Message Types","",""
"Verifies that a link preview disappears as expected in a group conversation","89669","Disappearing link to group @ios @low-risk @3-devices","Disappearing Messages","2026-02-27","passed","2026-02-27","","Message Types","",""
"Verifies that a user's placeholder avatar color appears the same to a contact","102796","Check placeholder avatar color @ios @medium-risk @2-devices","Visual Checks","2026-02-27","passed","2026-02-27","","Settings","",""
"Verifies that an admin can delete a group successfully via the UI.
  The group members see the empty state control message, and the admin's conversation disappears from the home screen, even on a linked device.","74293","Delete group linked device @ios @high-risk @4-devices","Groups","2026-02-27","failed","2026-02-27","","Leave/Delete Group","",""
"Verifies that a community invite disappears as expected in a 1:1 conversation","108038","Disappearing community invite message 1:1 @ios @low-risk @2-devices","Disappearing Messages","2026-02-27","passed","2026-02-27","","Message Types","",""
"Mocks a custom install date 6 days, 23 hours, and 58 minutes ago, opens the app, and verifies that the Donate CTA does not show.","30576","Donate CTA does not show if app installed <7 days ago @ios @high-risk @1-devices","Donations","2026-02-27","passed","2026-02-27","","cta_donate_time.spec.ts","",""
"Verifies that a non-admin member can leave a group successfully via the UI","62788","Leave group @ios @high-risk @3-devices","Groups","2026-02-27","passed","2026-02-27","","Leave/Delete Group","",""
"Verifies that inviting a contact (Android: without chat history) works as expected.","84530","Invite contact to group without chat history @ios @high-risk @4-devices","Groups","2026-02-27","passed","2026-02-27","","Edit Group","",""
"","60946","Upload animated profile picture (Pro) @ios @high-risk @1-devices","User Actions","2026-02-27","passed","2026-02-27","","Change Profile Picture","",""
