"DESCRIPTION","DURATION IN MS","NAME","PARENT SUITE","START TIME","STATUS","STOP TIME","SUB SUITE","SUITE","TEST CLASS","TEST METHOD"
"Verifies that a GIF can be sent to a group, all members receive the document, and replying to a document works as expected","60621","Send GIF to group @ios @medium-risk @3-devices","Sending Messages","Fri Oct 17 09:38:51 AEDT 2025","passed","Fri Oct 17 09:39:52 AEDT 2025","","Message types","",""
"Verifies that an emoji reaction can be sent and is received in a community","385992","Send emoji react community @ios @medium-risk @2-devices","Sending Messages","Fri Oct 17 09:23:09 AEDT 2025","failed","Fri Oct 17 09:29:35 AEDT 2025","","Emoji reacts","",""
"Verifies that the Settings page screen layout matches the expected baseline","16965","Check Settings page layout @ios @high-risk @1-devices","Visual Checks","Fri Oct 17 10:10:09 AEDT 2025","passed","Fri Oct 17 10:10:26 AEDT 2025","","Settings","",""
"Verifies message length behavior at 2000 characters - countdown shows 0, message sends","60696","Message length limit (2000 chars) @ios @high-risk @1-devices","Sending Messages","Fri Oct 17 09:58:46 AEDT 2025","passed","Fri Oct 17 09:59:47 AEDT 2025","","Rules","",""
"","66196","Send long message 1:1 @ios @low-risk @2-devices","","Fri Oct 17 09:59:47 AEDT 2025","passed","Fri Oct 17 10:00:53 AEDT 2025","","message_long_text.spec.ts","",""
"Verifies message length behavior at 2001 characters - countdown shows -1, cannot send message","63014","Message length limit (2001 chars) @ios @high-risk @1-devices","Sending Messages","Fri Oct 17 09:58:47 AEDT 2025","passed","Fri Oct 17 09:59:50 AEDT 2025","","Rules","",""
