"DESCRIPTION","DURATION IN MS","NAME","PARENT SUITE","START TIME","STATUS","STOP TIME","SUB SUITE","SUITE","TEST CLASS","TEST METHOD"
"Verifies that a too long display name (101 bytes) throws the 'shorter display name' error as expected.","14204","Onboarding long name @ios @low-risk @1-devices","Onboarding","Tue Dec 09 14:24:23 AEDT 2025","passed","Tue Dec 09 14:24:37 AEDT 2025","","Input validations","",""
"Verifies the in-app review modal texts and buttons for the positive flow (Enjoying Session - Rate App)","18424","Review prompt positive flow @ios @high-risk @1-devices","In-App Review Prompt","Tue Dec 09 14:37:54 AEDT 2025","passed","Tue Dec 09 14:38:12 AEDT 2025","","Flows","",""
"Verifies that the in-app review prompt shows after the user visits the Path screen in Settings","18740","Review prompt Path trigger @ios @high-risk @1-devices","In-App Review Prompt","Tue Dec 09 14:38:12 AEDT 2025","passed","Tue Dec 09 14:38:31 AEDT 2025","","Triggers","",""
"Mocks a custom install date 7 days 2 minutes ago, opens the app, and verifies that the Donate CTA is shown.","25416","Donate CTA shows if app installed >=7 days ago @ios @high-risk @1-devices","Donations","Tue Dec 09 14:07:09 AEDT 2025","passed","Tue Dec 09 14:07:34 AEDT 2025","","cta_donate_time.spec.ts","",""
"Verifies that a GIF disappears as expected in a 1:1 conversation","109537","Disappearing GIF message 1:1 @ios @low-risk @2-devices","Disappearing Messages","Tue Dec 09 14:11:12 AEDT 2025","passed","Tue Dec 09 14:13:01 AEDT 2025","","Message Types","",""
"Verifies that an image disappears as expected in a group conversation","92518","Disappearing image message to group @ios @low-risk @3-devices","Disappearing Messages","Tue Dec 09 14:15:01 AEDT 2025","passed","Tue Dec 09 14:16:34 AEDT 2025","","Message Types","",""
"Verifies that ONS resolution works","18046","ONS resolution @ios @high-risk @1-devices","New Conversation","Tue Dec 09 14:37:15 AEDT 2025","passed","Tue Dec 09 14:37:33 AEDT 2025","","New Message","",""
"Verifies message length behavior at 1800 characters - countdown shows 200, message sends","55969","Message length limit (1800 chars) @ios @high-risk @1-devices","Sending Messages","Tue Dec 09 14:30:39 AEDT 2025","passed","Tue Dec 09 14:31:35 AEDT 2025","","Rules","",""
"","39091","Unsend message @ios @high-risk @2-devices","","Tue Dec 09 14:34:20 AEDT 2025","passed","Tue Dec 09 14:34:59 AEDT 2025","","message_unsend.spec.ts","",""
"Verifies that a video disappears as expected in a 1:1 conversation","116807","Disappearing video message 1:1 @ios @low-risk @2-devices","Disappearing Messages","Tue Dec 09 14:13:01 AEDT 2025","passed","Tue Dec 09 14:14:58 AEDT 2025","","Message Types","",""
"Verifies that a too long seed phrase throws the 'check your recovery password' error as expected.","13218","Onboarding wrong seed @ios @low-risk @1-devices","Onboarding","Tue Dec 09 14:24:37 AEDT 2025","passed","Tue Dec 09 14:24:51 AEDT 2025","","Input validations","",""
"Verifies that a user can share an image from the photo gallery to Session","58680","Share to session @ios @medium-risk @2-devices","User Actions","Tue Dec 09 14:40:52 AEDT 2025","passed","Tue Dec 09 14:41:51 AEDT 2025","","Share to Session","",""
"","33197","Message requests clear all @ios @medium-risk @2-devices","","Tue Dec 09 14:33:38 AEDT 2025","passed","Tue Dec 09 14:34:11 AEDT 2025","","message_requests_clear_all.spec.ts","",""
"","39582","Accept message request with text @ios @high-risk @2-devices","","Tue Dec 09 14:32:30 AEDT 2025","passed","Tue Dec 09 14:33:10 AEDT 2025","","message_requests_accept_text_reply.spec.ts","",""
"Verifies that a non-admin member can leave a group successfully via the UI","40287","Leave group @ios @high-risk @3-devices","Groups","Tue Dec 09 14:23:32 AEDT 2025","passed","Tue Dec 09 14:24:12 AEDT 2025","","Leave/Delete Group","",""
"Verifies Note to Self can be hidden and then unhidden/shown again in the conversation settings","37806","Hide note to self @ios @low-risk @1-devices","User Actions","Tue Dec 09 14:40:13 AEDT 2025","passed","Tue Dec 09 14:40:51 AEDT 2025","","Hide Note to Self","",""
"Verifies that an image can be sent to a group, all members receive the document, and replying to a document works as expected","57798","Send image to group @ios @high-risk @3-devices","Sending Messages","Tue Dec 09 14:18:49 AEDT 2025","passed","Tue Dec 09 14:19:47 AEDT 2025","","Message types","",""
"Verifies that leaving a group syncs to a linked device","124144","Leave group linked device @ios @high-risk @4-devices","Groups","Tue Dec 09 14:28:16 AEDT 2025","passed","Tue Dec 09 14:30:20 AEDT 2025","","Leave/Delete Group","",""
"Verifies that message bubbles appear as expected (oneline and multiline messages, reply layout, outgoing/incoming)","40530","Check message bubble layout @ios @high-risk @2-devices","Visual Checks","Tue Dec 09 14:41:31 AEDT 2025","passed","Tue Dec 09 14:42:12 AEDT 2025","","Conversation","",""
"Verifies that mentions can be sent to a group, and that all participants see them correctly.","50893","Mentions for groups @ios @medium-risk @3-devices","Sending Messages","Tue Dec 09 14:23:38 AEDT 2025","passed","Tue Dec 09 14:24:29 AEDT 2025","","Mentions","",""
"Verifies voice call functionality and permission flow:
    - Verifies strings of all call permission prompts (microphone, notifications, etc.)
    - Verifies missed call notifications when recipient lacks permissions
    - Confirms successful call connection once both users enable permissions
    - Verifies control messages after call is finished
    Note that due to the nature of virtual devices, no actual ""talking"" takes place","73717","Voice calls @ios @high-risk @2-devices","Voice Calls","Tue Dec 09 14:43:41 AEDT 2025","passed","Tue Dec 09 14:44:55 AEDT 2025","","voice_calls.spec.ts","",""
"","39677","Send link 1:1 @ios @high-risk @2-devices","","Tue Dec 09 14:31:35 AEDT 2025","passed","Tue Dec 09 14:32:14 AEDT 2025","","message_link_preview.spec.ts","",""
"","38319","Hide recovery password @ios @medium-risk @2-devices","","Tue Dec 09 14:40:14 AEDT 2025","passed","Tue Dec 09 14:40:52 AEDT 2025","","user_actions_hide_recovery_password.spec.ts","",""
