"DESCRIPTION","DURATION IN MS","NAME","PARENT SUITE","START TIME","STATUS","STOP TIME","SUB SUITE","SUITE","TEST CLASS","TEST METHOD"
"Verifies message length behavior at 2001 characters - countdown shows -1, cannot send message","62596","Message length limit (2001 chars) @ios @high-risk @1-devices","Sending Messages","Thu Oct 23 10:04:06 AEDT 2025","passed","Thu Oct 23 10:05:09 AEDT 2025","","Rules","",""
"Verifies that Disappearing Messages can be set in Note to Self, and that a message disappears after the specified expiry time.","68854","Disappear after send note to self @ios @medium-risk @1-devices","Disappearing Messages","Thu Oct 23 09:36:00 AEDT 2025","passed","Thu Oct 23 09:37:09 AEDT 2025","","Conversation Types","",""
"Verifies message length behavior at 1799 characters - no countdown shows, message sends","58589","Message length limit (1799 chars) @ios @high-risk @1-devices","Sending Messages","Thu Oct 23 10:03:08 AEDT 2025","passed","Thu Oct 23 10:04:06 AEDT 2025","","Rules","",""
"Verifies that the Settings page screen layout matches the expected baseline","17558","Check Settings page layout @ios @high-risk @1-devices","Visual Checks","Thu Oct 23 10:14:34 AEDT 2025","passed","Thu Oct 23 10:14:51 AEDT 2025","","Settings","",""
"Verifies that only admins can enable Disappearing Messages in a group","36042","Group member disappearing messages @ios @medium-risk @3-devices","Disappearing Messages","Thu Oct 23 09:43:13 AEDT 2025","passed","Thu Oct 23 09:43:49 AEDT 2025","","Rules","",""
"Verifies that a user can set a nickname for a contact and that it appears correctly in the conversation settings, conversation header and home screen.","30637","Set nickname @ios @high-risk @2-devices","User Actions","Thu Oct 23 10:13:24 AEDT 2025","passed","Thu Oct 23 10:13:55 AEDT 2025","","Set Nickname","",""
"Verifies that a video disappears as expected in a group conversation","117924","Disappearing video to group @ios @low-risk @3-devices","Disappearing Messages","Thu Oct 23 09:43:36 AEDT 2025","passed","Thu Oct 23 09:45:34 AEDT 2025","","Message Types","",""
"Verifies that a GIF disappears as expected in a 1:1 conversation","111040","Disappearing GIF message 1:1 @ios @low-risk @2-devices","Disappearing Messages","Thu Oct 23 09:37:14 AEDT 2025","passed","Thu Oct 23 09:39:05 AEDT 2025","","Message Types","",""
